{
  "schema": "tradecat_auto.portfolio_risk_policy.v1",
  "schema_version": "1.0.0",
  "mode": "paper",
  "enabled": true,
  "new_entries_enabled": false,
  "limits": {
    "max_daily_loss_usdt": 25,
    "max_drawdown_usdt": 50,
    "max_open_positions": 1,
    "max_positions_per_symbol": 1,
    "max_symbol_notional_usdt": 50,
    "max_total_notional_usdt": 50,
    "max_symbol_risk_usdt": 5,
    "max_symbol_risk_pct": 0.01,
    "max_leverage": 3,
    "min_agent_confidence": 0.75,
    "cooldown_minutes_after_reject": 60,
    "cooldown_minutes_after_close": 30,
    "abnormal_move_halt_bps": 500,
    "max_consecutive_losses": 1
  },
  "kill_switch": {
    "active": true,
    "reason": "operator paused local paper loop",
    "source": "operator_local_policy"
  },
  "provenance": {
    "source": "portfolio_risk_policy_fixture",
    "generated_at": "2026-05-18T00:00:00Z"
  },
  "safety": {
    "public_readonly_market_data": true,
    "public_readonly": true,
    "paper_or_watch_only": true,
    "real_orders": false,
    "signed_requests": false,
    "reads_api_keys": false,
    "binance_account_state": false
  },
  "hard_boundaries": {
    "does_not_set_order_size": true,
    "does_not_set_leverage": true,
    "does_not_set_exit_plan": true,
    "real_orders": false,
    "signed_requests": false,
    "reads_api_keys": false
  },
  "limitations": [
    "paper/watch risk rejection policy only",
    "no real exchange order is authorized"
  ]
}
